🚀 Running K6 performance test...
=================================

         /\      Grafana   /‾‾/  
    /\  /  \     |\  __   /  /   
   /  \/    \    | |/ /  /   ‾‾\ 
  /          \   |   (  |  (‾)  |
 / __________ \  |_|\_\  \_____/ 


     execution: local
        script: -
        output: -

     scenarios: (100.00%) 1 scenario, 10 max VUs, 2m30s max duration (incl. graceful stop):
              * default: Up to 10 looping VUs for 2m0s over 3 stages (gracefulRampDown: 30s, gracefulStop: 30s)


running (0m01.0s), 01/10 VUs, 0 complete and 0 interrupted iterations
default   [   1% ] 01/10 VUs  0m01.0s/2m00.0s

running (0m02.0s), 01/10 VUs, 1 complete and 0 interrupted iterations
default   [   2% ] 01/10 VUs  0m02.0s/2m00.0s

running (0m03.0s), 01/10 VUs, 2 complete and 0 interrupted iterations
default   [   2% ] 01/10 VUs  0m03.0s/2m00.0s

running (0m04.0s), 02/10 VUs, 3 complete and 0 interrupted iterations
default   [   3% ] 02/10 VUs  0m04.0s/2m00.0s

running (0m05.0s), 02/10 VUs, 5 complete and 0 interrupted iterations
default   [   4% ] 02/10 VUs  0m05.0s/2m00.0s

running (0m06.0s), 02/10 VUs, 7 complete and 0 interrupted iterations
default   [   5% ] 02/10 VUs  0m06.0s/2m00.0s

running (0m07.0s), 03/10 VUs, 9 complete and 0 interrupted iterations
default   [   6% ] 03/10 VUs  0m07.0s/2m00.0s

running (0m08.0s), 03/10 VUs, 12 complete and 0 interrupted iterations
default   [   7% ] 03/10 VUs  0m08.0s/2m00.0s

running (0m09.0s), 03/10 VUs, 15 complete and 0 interrupted iterations
default   [   7% ] 03/10 VUs  0m09.0s/2m00.0s

running (0m10.0s), 03/10 VUs, 18 complete and 0 interrupted iterations
default   [   8% ] 03/10 VUs  0m10.0s/2m00.0s

running (0m11.0s), 04/10 VUs, 21 complete and 0 interrupted iterations
default   [   9% ] 04/10 VUs  0m11.0s/2m00.0s

running (0m12.0s), 04/10 VUs, 25 complete and 0 interrupted iterations
default   [  10% ] 04/10 VUs  0m12.0s/2m00.0s

running (0m13.0s), 04/10 VUs, 29 complete and 0 interrupted iterations
default   [  11% ] 04/10 VUs  0m13.0s/2m00.0s

running (0m14.0s), 05/10 VUs, 33 complete and 0 interrupted iterations
default   [  12% ] 05/10 VUs  0m14.0s/2m00.0s

running (0m15.0s), 05/10 VUs, 38 complete and 0 interrupted iterations
default   [  12% ] 05/10 VUs  0m15.0s/2m00.0s

running (0m16.0s), 05/10 VUs, 43 complete and 0 interrupted iterations
default   [  13% ] 05/10 VUs  0m16.0s/2m00.0s

running (0m17.0s), 06/10 VUs, 48 complete and 0 interrupted iterations
default   [  14% ] 06/10 VUs  0m17.0s/2m00.0s

running (0m18.0s), 06/10 VUs, 54 complete and 0 interrupted iterations
default   [  15% ] 06/10 VUs  0m18.0s/2m00.0s

running (0m19.0s), 06/10 VUs, 60 complete and 0 interrupted iterations
default   [  16% ] 06/10 VUs  0m19.0s/2m00.0s

running (0m20.0s), 06/10 VUs, 66 complete and 0 interrupted iterations
default   [  17% ] 06/10 VUs  0m20.0s/2m00.0s

running (0m21.0s), 07/10 VUs, 72 complete and 0 interrupted iterations
default   [  17% ] 07/10 VUs  0m21.0s/2m00.0s

running (0m22.0s), 07/10 VUs, 79 complete and 0 interrupted iterations
default   [  18% ] 07/10 VUs  0m22.0s/2m00.0s

running (0m23.0s), 07/10 VUs, 86 complete and 0 interrupted iterations
default   [  19% ] 07/10 VUs  0m23.0s/2m00.0s

running (0m24.0s), 08/10 VUs, 93 complete and 0 interrupted iterations
default   [  20% ] 08/10 VUs  0m24.0s/2m00.0s

running (0m25.0s), 08/10 VUs, 101 complete and 0 interrupted iterations
default   [  21% ] 08/10 VUs  0m25.0s/2m00.0s

running (0m26.0s), 08/10 VUs, 109 complete and 0 interrupted iterations
default   [  22% ] 08/10 VUs  0m26.0s/2m00.0s

running (0m27.0s), 09/10 VUs, 117 complete and 0 interrupted iterations
default   [  22% ] 09/10 VUs  0m27.0s/2m00.0s

running (0m28.0s), 09/10 VUs, 126 complete and 0 interrupted iterations
default   [  23% ] 09/10 VUs  0m28.0s/2m00.0s

running (0m29.0s), 09/10 VUs, 135 complete and 0 interrupted iterations
default   [  24% ] 09/10 VUs  0m29.0s/2m00.0s

running (0m30.0s), 09/10 VUs, 144 complete and 0 interrupted iterations
default   [  25% ] 09/10 VUs  0m30.0s/2m00.0s

running (0m31.0s), 10/10 VUs, 153 complete and 0 interrupted iterations
default   [  26% ] 10/10 VUs  0m31.0s/2m00.0s

running (0m32.0s), 10/10 VUs, 163 complete and 0 interrupted iterations
default   [  27% ] 10/10 VUs  0m32.0s/2m00.0s

running (0m33.0s), 10/10 VUs, 173 complete and 0 interrupted iterations
default   [  27% ] 10/10 VUs  0m33.0s/2m00.0s

running (0m34.0s), 10/10 VUs, 183 complete and 0 interrupted iterations
default   [  28% ] 10/10 VUs  0m34.0s/2m00.0s

running (0m35.0s), 10/10 VUs, 193 complete and 0 interrupted iterations
default   [  29% ] 10/10 VUs  0m35.0s/2m00.0s

running (0m36.0s), 10/10 VUs, 203 complete and 0 interrupted iterations
default   [  30% ] 10/10 VUs  0m36.0s/2m00.0s

running (0m37.0s), 10/10 VUs, 213 complete and 0 interrupted iterations
default   [  31% ] 10/10 VUs  0m37.0s/2m00.0s

running (0m38.0s), 10/10 VUs, 223 complete and 0 interrupted iterations
default   [  32% ] 10/10 VUs  0m38.0s/2m00.0s

running (0m39.0s), 10/10 VUs, 233 complete and 0 interrupted iterations
default   [  32% ] 10/10 VUs  0m39.0s/2m00.0s

running (0m40.0s), 10/10 VUs, 243 complete and 0 interrupted iterations
default   [  33% ] 10/10 VUs  0m40.0s/2m00.0s

running (0m41.0s), 10/10 VUs, 253 complete and 0 interrupted iterations
default   [  34% ] 10/10 VUs  0m41.0s/2m00.0s

running (0m42.0s), 10/10 VUs, 263 complete and 0 interrupted iterations
default   [  35% ] 10/10 VUs  0m42.0s/2m00.0s

running (0m43.0s), 10/10 VUs, 273 complete and 0 interrupted iterations
default   [  36% ] 10/10 VUs  0m43.0s/2m00.0s

running (0m44.0s), 10/10 VUs, 283 complete and 0 interrupted iterations
default   [  37% ] 10/10 VUs  0m44.0s/2m00.0s

running (0m45.0s), 10/10 VUs, 293 complete and 0 interrupted iterations
default   [  37% ] 10/10 VUs  0m45.0s/2m00.0s

running (0m46.0s), 10/10 VUs, 303 complete and 0 interrupted iterations
default   [  38% ] 10/10 VUs  0m46.0s/2m00.0s

running (0m47.0s), 10/10 VUs, 313 complete and 0 interrupted iterations
default   [  39% ] 10/10 VUs  0m47.0s/2m00.0s

running (0m48.0s), 10/10 VUs, 323 complete and 0 interrupted iterations
default   [  40% ] 10/10 VUs  0m48.0s/2m00.0s

running (0m49.0s), 10/10 VUs, 333 complete and 0 interrupted iterations
default   [  41% ] 10/10 VUs  0m49.0s/2m00.0s

running (0m50.0s), 10/10 VUs, 343 complete and 0 interrupted iterations
default   [  42% ] 10/10 VUs  0m50.0s/2m00.0s

running (0m51.0s), 10/10 VUs, 353 complete and 0 interrupted iterations
default   [  42% ] 10/10 VUs  0m51.0s/2m00.0s

running (0m52.0s), 10/10 VUs, 363 complete and 0 interrupted iterations
default   [  43% ] 10/10 VUs  0m52.0s/2m00.0s

running (0m53.0s), 10/10 VUs, 373 complete and 0 interrupted iterations
default   [  44% ] 10/10 VUs  0m53.0s/2m00.0s

running (0m54.0s), 10/10 VUs, 382 complete and 0 interrupted iterations
default   [  45% ] 10/10 VUs  0m54.0s/2m00.0s

running (0m55.0s), 10/10 VUs, 392 complete and 0 interrupted iterations
default   [  46% ] 10/10 VUs  0m55.0s/2m00.0s

running (0m56.0s), 10/10 VUs, 402 complete and 0 interrupted iterations
default   [  47% ] 10/10 VUs  0m56.0s/2m00.0s

running (0m57.0s), 10/10 VUs, 412 complete and 0 interrupted iterations
default   [  47% ] 10/10 VUs  0m57.0s/2m00.0s

running (0m58.0s), 10/10 VUs, 422 complete and 0 interrupted iterations
default   [  48% ] 10/10 VUs  0m58.0s/2m00.0s

running (0m59.0s), 10/10 VUs, 432 complete and 0 interrupted iterations
default   [  49% ] 10/10 VUs  0m59.0s/2m00.0s

running (1m00.0s), 10/10 VUs, 442 complete and 0 interrupted iterations
default   [  50% ] 10/10 VUs  1m00.0s/2m00.0s

running (1m01.0s), 10/10 VUs, 452 complete and 0 interrupted iterations
default   [  51% ] 10/10 VUs  1m01.0s/2m00.0s

running (1m02.0s), 10/10 VUs, 462 complete and 0 interrupted iterations
default   [  52% ] 10/10 VUs  1m02.0s/2m00.0s

running (1m03.0s), 10/10 VUs, 472 complete and 0 interrupted iterations
default   [  52% ] 10/10 VUs  1m03.0s/2m00.0s

running (1m04.0s), 10/10 VUs, 482 complete and 0 interrupted iterations
default   [  53% ] 10/10 VUs  1m04.0s/2m00.0s

running (1m05.0s), 10/10 VUs, 492 complete and 0 interrupted iterations
default   [  54% ] 10/10 VUs  1m05.0s/2m00.0s

running (1m06.0s), 10/10 VUs, 501 complete and 0 interrupted iterations
default   [  55% ] 10/10 VUs  1m06.0s/2m00.0s

running (1m07.0s), 10/10 VUs, 511 complete and 0 interrupted iterations
default   [  56% ] 10/10 VUs  1m07.0s/2m00.0s

running (1m08.0s), 10/10 VUs, 521 complete and 0 interrupted iterations
default   [  57% ] 10/10 VUs  1m08.0s/2m00.0s

running (1m09.0s), 10/10 VUs, 531 complete and 0 interrupted iterations
default   [  57% ] 10/10 VUs  1m09.0s/2m00.0s

running (1m10.0s), 10/10 VUs, 541 complete and 0 interrupted iterations
default   [  58% ] 10/10 VUs  1m10.0s/2m00.0s

running (1m11.0s), 10/10 VUs, 551 complete and 0 interrupted iterations
default   [  59% ] 10/10 VUs  1m11.0s/2m00.0s

running (1m12.0s), 10/10 VUs, 561 complete and 0 interrupted iterations
default   [  60% ] 10/10 VUs  1m12.0s/2m00.0s

running (1m13.0s), 10/10 VUs, 571 complete and 0 interrupted iterations
default   [  61% ] 10/10 VUs  1m13.0s/2m00.0s

running (1m14.0s), 10/10 VUs, 581 complete and 0 interrupted iterations
default   [  62% ] 10/10 VUs  1m14.0s/2m00.0s

running (1m15.0s), 10/10 VUs, 591 complete and 0 interrupted iterations
default   [  62% ] 10/10 VUs  1m15.0s/2m00.0s

running (1m16.0s), 10/10 VUs, 601 complete and 0 interrupted iterations
default   [  63% ] 10/10 VUs  1m16.0s/2m00.0s

running (1m17.0s), 10/10 VUs, 611 complete and 0 interrupted iterations
default   [  64% ] 10/10 VUs  1m17.0s/2m00.0s

running (1m18.0s), 10/10 VUs, 621 complete and 0 interrupted iterations
default   [  65% ] 10/10 VUs  1m18.0s/2m00.0s

running (1m19.0s), 10/10 VUs, 631 complete and 0 interrupted iterations
default   [  66% ] 10/10 VUs  1m19.0s/2m00.0s

running (1m20.0s), 10/10 VUs, 641 complete and 0 interrupted iterations
default   [  67% ] 10/10 VUs  1m20.0s/2m00.0s

running (1m21.0s), 10/10 VUs, 651 complete and 0 interrupted iterations
default   [  67% ] 10/10 VUs  1m21.0s/2m00.0s

running (1m22.0s), 10/10 VUs, 661 complete and 0 interrupted iterations
default   [  68% ] 10/10 VUs  1m22.0s/2m00.0s

running (1m23.0s), 10/10 VUs, 670 complete and 0 interrupted iterations
default   [  69% ] 10/10 VUs  1m23.0s/2m00.0s

running (1m24.0s), 10/10 VUs, 680 complete and 0 interrupted iterations
default   [  70% ] 10/10 VUs  1m24.0s/2m00.0s

running (1m25.0s), 10/10 VUs, 690 complete and 0 interrupted iterations
default   [  71% ] 10/10 VUs  1m25.0s/2m00.0s

running (1m26.0s), 10/10 VUs, 700 complete and 0 interrupted iterations
default   [  72% ] 10/10 VUs  1m26.0s/2m00.0s

running (1m27.0s), 10/10 VUs, 710 complete and 0 interrupted iterations
default   [  72% ] 10/10 VUs  1m27.0s/2m00.0s

running (1m28.0s), 10/10 VUs, 720 complete and 0 interrupted iterations
default   [  73% ] 10/10 VUs  1m28.0s/2m00.0s

running (1m29.0s), 10/10 VUs, 730 complete and 0 interrupted iterations
default   [  74% ] 10/10 VUs  1m29.0s/2m00.0s

running (1m30.0s), 10/10 VUs, 740 complete and 0 interrupted iterations
default   [  75% ] 10/10 VUs  1m30.0s/2m00.0s

running (1m31.0s), 10/10 VUs, 750 complete and 0 interrupted iterations
default   [  76% ] 10/10 VUs  1m31.0s/2m00.0s

running (1m32.0s), 10/10 VUs, 760 complete and 0 interrupted iterations
default   [  77% ] 10/10 VUs  1m32.0s/2m00.0s

running (1m33.0s), 10/10 VUs, 770 complete and 0 interrupted iterations
default   [  77% ] 10/10 VUs  1m33.0s/2m00.0s

running (1m34.0s), 09/10 VUs, 780 complete and 0 interrupted iterations
default   [  78% ] 09/10 VUs  1m34.0s/2m00.0s

running (1m35.0s), 09/10 VUs, 789 complete and 0 interrupted iterations
default   [  79% ] 09/10 VUs  1m35.0s/2m00.0s

running (1m36.0s), 09/10 VUs, 798 complete and 0 interrupted iterations
default   [  80% ] 09/10 VUs  1m36.0s/2m00.0s

running (1m37.0s), 08/10 VUs, 806 complete and 0 interrupted iterations
default   [  81% ] 08/10 VUs  1m37.0s/2m00.0s

running (1m38.0s), 08/10 VUs, 814 complete and 0 interrupted iterations
default   [  82% ] 08/10 VUs  1m38.0s/2m00.0s

running (1m39.0s), 08/10 VUs, 822 complete and 0 interrupted iterations
default   [  82% ] 08/10 VUs  1m39.0s/2m00.0s

running (1m40.0s), 07/10 VUs, 830 complete and 0 interrupted iterations
default   [  83% ] 07/10 VUs  1m40.0s/2m00.0s

running (1m41.0s), 07/10 VUs, 837 complete and 0 interrupted iterations
default   [  84% ] 07/10 VUs  1m41.0s/2m00.0s

running (1m42.0s), 07/10 VUs, 844 complete and 0 interrupted iterations
default   [  85% ] 07/10 VUs  1m42.0s/2m00.0s

running (1m43.0s), 06/10 VUs, 851 complete and 0 interrupted iterations
default   [  86% ] 06/10 VUs  1m43.0s/2m00.0s

running (1m44.0s), 06/10 VUs, 857 complete and 0 interrupted iterations
default   [  87% ] 06/10 VUs  1m44.0s/2m00.0s

running (1m45.0s), 06/10 VUs, 863 complete and 0 interrupted iterations
default   [  87% ] 06/10 VUs  1m45.0s/2m00.0s

running (1m46.0s), 05/10 VUs, 869 complete and 0 interrupted iterations
default   [  88% ] 05/10 VUs  1m46.0s/2m00.0s

running (1m47.0s), 05/10 VUs, 874 complete and 0 interrupted iterations
default   [  89% ] 05/10 VUs  1m47.0s/2m00.0s

running (1m48.0s), 05/10 VUs, 879 complete and 0 interrupted iterations
default   [  90% ] 05/10 VUs  1m48.0s/2m00.0s

running (1m49.0s), 04/10 VUs, 884 complete and 0 interrupted iterations
default   [  91% ] 04/10 VUs  1m49.0s/2m00.0s

running (1m50.0s), 04/10 VUs, 888 complete and 0 interrupted iterations
default   [  92% ] 04/10 VUs  1m50.0s/2m00.0s

running (1m51.0s), 04/10 VUs, 892 complete and 0 interrupted iterations
default   [  92% ] 04/10 VUs  1m51.0s/2m00.0s

running (1m52.0s), 03/10 VUs, 896 complete and 0 interrupted iterations
default   [  93% ] 03/10 VUs  1m52.0s/2m00.0s

running (1m53.0s), 03/10 VUs, 899 complete and 0 interrupted iterations
default   [  94% ] 03/10 VUs  1m53.0s/2m00.0s

running (1m54.0s), 03/10 VUs, 902 complete and 0 interrupted iterations
default   [  95% ] 03/10 VUs  1m54.0s/2m00.0s

running (1m55.0s), 02/10 VUs, 905 complete and 0 interrupted iterations
default   [  96% ] 02/10 VUs  1m55.0s/2m00.0s

running (1m56.0s), 02/10 VUs, 907 complete and 0 interrupted iterations
default   [  97% ] 02/10 VUs  1m56.0s/2m00.0s

running (1m57.0s), 02/10 VUs, 909 complete and 0 interrupted iterations
default   [  97% ] 02/10 VUs  1m57.0s/2m00.0s

running (1m58.0s), 01/10 VUs, 911 complete and 0 interrupted iterations
default   [  98% ] 01/10 VUs  1m58.0s/2m00.0s

running (1m59.0s), 01/10 VUs, 912 complete and 0 interrupted iterations
default   [  99% ] 01/10 VUs  1m59.0s/2m00.0s

running (2m00.0s), 01/10 VUs, 913 complete and 0 interrupted iterations
default   [ 100% ] 01/10 VUs  2m00.0s/2m00.0s


  █ TOTAL RESULTS 

    checks_total.......: 914     7.562069/s
    checks_succeeded...: 100.00% 914 out of 914
    checks_failed......: 0.00%   0 out of 914

    ✓ status is 201

    HTTP
    http_req_duration..............: avg=5.42ms min=3.13ms med=4.58ms max=27.44ms p(90)=8.37ms p(95)=10.15ms
      { expected_response:true }...: avg=5.42ms min=3.13ms med=4.58ms max=27.44ms p(90)=8.37ms p(95)=10.15ms
    http_req_failed................: 0.00%  0 out of 914
    http_reqs......................: 914    7.562069/s

    EXECUTION
    iteration_duration.............: avg=1s     min=1s     med=1s     max=1.02s   p(90)=1s     p(95)=1.01s  
    iterations.....................: 914    7.562069/s
    vus............................: 1      min=1        max=10
    vus_max........................: 10     min=10       max=10

    NETWORK
    data_received..................: 241 kB 2.0 kB/s
    data_sent......................: 250 kB 2.1 kB/s




running (2m00.9s), 00/10 VUs, 914 complete and 0 interrupted iterations
default ✓ [ 100% ] 00/10 VUs  2m0s
✅ K6 test complete!
